{
  "$schema": "https://json-schema.org/draft/2020-12/schema",
  "$id": "https://github.com/ryanduguid/australian-accounting-skills/blob/main/validation/results.schema.json",
  "title": "Validation run result",
  "description": "One manual run of the fabricated validation cards against a model. Records the model, the date and a pass or fail per card, and nothing else: no prompts, outputs or transcripts.",
  "type": "object",
  "required": ["model", "run_date", "skills_version", "runner", "results"],
  "additionalProperties": false,
  "properties": {
    "model": {"type": "string", "minLength": 1, "description": "The model evaluated, as its vendor names it."},
    "run_date": {"type": "string", "format": "date", "description": "The day the run finished, YYYY-MM-DD."},
    "skills_version": {"type": "string", "minLength": 1, "description": "The release tag or commit of this repository the run used."},
    "runner": {"type": "string", "minLength": 1, "description": "The person who judged the outputs."},
    "results": {
      "type": "object",
      "description": "One verdict per card, keyed by the card id from validation/cases/ without the .md suffix. A card appears at most once because a JSON object holds one value per key.",
      "minProperties": 1,
      "propertyNames": {"enum": [
        "au-bookkeeping-missing-evidence",
        "au-bookkeeping-supported-reconciliation",
        "au-business-formation-missing-evidence",
        "au-capital-gains-missing-evidence",
        "au-company-tax-missing-evidence",
        "au-crypto-tax-missing-evidence",
        "au-deceased-estates-missing-evidence",
        "au-financial-statements-missing-evidence",
        "au-financial-statements-supported-mapping",
        "au-foreign-income-missing-evidence",
        "au-forex-review-missing-evidence",
        "au-gst-property-missing-evidence",
        "au-gst-registration-review-missing-evidence",
        "au-individual-return-missing-evidence",
        "au-land-tax-missing-evidence",
        "au-medicare-review-missing-evidence",
        "au-nonresident-cgt-missing-evidence",
        "au-not-for-profit-missing-evidence",
        "au-partnership-tax-missing-evidence",
        "au-payroll-review-missing-evidence",
        "au-payroll-review-supported-tie-out",
        "au-psi-review-missing-evidence",
        "au-rd-incentive-missing-evidence",
        "au-rental-property-missing-evidence",
        "au-return-amendment-missing-evidence",
        "au-small-business-cgt-missing-evidence",
        "au-smsf-year-end-missing-evidence",
        "au-sole-trader-missing-evidence",
        "au-tax-planning-review-missing-evidence",
        "au-tax-rates-verification-missing-evidence",
        "au-tax-residency-missing-evidence",
        "au-transfer-duty-missing-evidence",
        "au-transfer-pricing-missing-evidence",
        "au-trust-distributions-missing-evidence",
        "bas-export-manifest-rounding",
        "bas-g10-g11",
        "bas-stp-w3-w4",
        "cashflow-super-regime-transition",
        "coal-lsl-levy-unverified-rate",
        "contract-cost-unallocated-plant",
        "div7a-upe-review",
        "export-manifest-rounding",
        "fbt-carparking-missing-declaration",
        "fuel-tax-credits-missing-docket",
        "payroll-tax-contractor-characterisation",
        "post-journal-provenance-tie-out",
        "progress-claim-missing-reference-date",
        "retention-release-missing-deed",
        "standalone-skill-safety-boundary",
        "stp-current-vs-overdue-sg",
        "wip-cost-to-complete-gap"
      ]},
      "additionalProperties": {"type": "string", "enum": ["pass", "fail"]}
    }
  }
}
